{
	"$schema": "config.schema.json",
	"notionDatabaseId": "",
	"notionDataSourceId": "",
	"updateInterval": 60000,
	"steamAppIdProperty": "Steam App ID",
	"forceReset": false,
	"alwaysUpdate": false,
	"steamUser": {
		"accountName": "<steamAccountName>"
	},
	"gameProperties": {
		"gameName": {
			"enabled": true,
			"notionProperty": "Name",
			"isPageTitle": true
		},
		"coverImage": {
			"enabled": true,
			"default": "https://cdn.cloudflare.steamstatic.com/store/home/store_home_share.jpg"
		},
		"gameIcon": {
			"enabled": true,
			"default": "https://help.steampowered.com/public/shared/images/responsive/share_steam_logo.png"
		},
		"releaseDate": {
			"enabled": true,
			"notionProperty": "Release Date"
		},
		"reviewScore": {
			"enabled": true,
			"format": "percentage",
			"notionProperty": "Review Score"
		},
		"tags": {
			"enabled": true,
			"notionProperty": "Tags",
			"tagLanguage": "english"
		},
		"gameDescription": {
			"enabled": true,
			"notionProperty": "Description"
		},
		"storePage": {
			"enabled": true,
			"notionProperty": "Store Page"
		},
		"gamePrice": {
			"enabled": true,
			"notionProperty": "Price"
		},
		"steamDeckCompatibility": {
			"enabled": true,
			"notionProperty": "Steam Deck Compatibility"
		},
		"gameDevelopers": {
			"enabled": true,
			"notionProperty": "Developers"
		},
		"gamePublishers": {
			"enabled": true,
			"notionProperty": "Publishers"
		}
	}
}
